{
  "times": {
    "weekday_start": "17:30:00",
    "weekend_start": "09:00:00"
  },
  "weekday_caps": {
    "max_minutes": 90,
    "hard_max_minutes": 105,
    "allow_single_105": true
  },
  "long_ride": {
    "min_minutes_for_weekend": 120,
    "primary_day": "SAT",
    "backup_day": "SUN",
    "require_weekend_for_long": true
  },
  "weather_durations": {
    "build": {
      "dry":    { "venue": "OUTDOOR", "min_hours": 4, "max_hours": 6 },
      "rain":   { "venue": "INDOOR",  "min_hours": 3, "max_hours": 4 },
      "mixed":  { "venue": "INDOOR",  "min_hours": 3, "max_hours": 4, "note": "If forecast clears → OUTDOOR 4–6 h." },
      "auto":   { "use_season_hint": true }
    },
    "recovery": {
      "dry":    { "venue": "OUTDOOR", "min_hours": 2, "max_hours": 3 },
      "rain":   { "venue": "INDOOR",  "min_hours": 1.5, "max_hours": 2 },
      "mixed":  { "venue": "INDOOR",  "min_hours": 1.5, "max_hours": 2, "note": "If clears → OUTDOOR 2–3 h." },
      "auto":   { "use_season_hint": true }
    }
  }
}
